{
  "schema_version": 1,
  "build_id": "build.reference.nova_ward",
  "skills": {
    "thunder_nova": 5,
    "static_ward": 5
  },
  "rotation": [
    {
      "tick": 1,
      "skill": "static_ward"
    },
    {
      "tick": 6,
      "skill": "thunder_nova"
    },
    {
      "tick": 106,
      "skill": "thunder_nova"
    },
    {
      "tick": 206,
      "skill": "thunder_nova"
    }
  ],
  "duration_ticks": 240,
  "root_seed": 42,
  "loadout": {
    "slot.weapon": {
      "uid": "profile.reference:1"
    }
  },
  "conditions": [],
  "objective": "defense",
  "base_stats": {
    "stat.offense.power": 10,
    "stat.critical.chance": 0,
    "stat.critical.multiplier": 1.5,
    "stat.defense.armor": 0
  }
}
