{
  "schema_version": 1,
  "build_id": "build.reference.storm_totem",
  "skills": {
    "storm_totem": 5
  },
  "rotation": [
    {
      "tick": 1,
      "skill": "storm_totem"
    }
  ],
  "duration_ticks": 240,
  "root_seed": 42,
  "loadout": {
    "slot.weapon": {
      "uid": "profile.reference:1"
    }
  },
  "conditions": [],
  "objective": "procs",
  "base_stats": {
    "stat.offense.power": 10,
    "stat.critical.chance": 0,
    "stat.critical.multiplier": 1.5,
    "stat.defense.armor": 0
  }
}
